{
  "name": "wc2_peasant",
  "display_name": "WC2 Peasant",
  "version": "1.0.0",
  "description": "WC2 Peasant sound pack from Warcraft II",
  "author": {
    "name": "sebbeth",
    "github": "sebbeth"
  },
  "source": {
    "type": "github",
    "repo": "PeonPing/og-packs",
    "ref": "v1.0.0",
    "path": "wc2_peasant"
  },
  "manifest_sha256": "dcaea0f2fbbd8b5da5717c86604cf3dc401dc35b09fdfe512cf9f19279d32d06",
  "trust_tier": "official",
  "categories": [
    "session.start",
    "task.acknowledge",
    "task.complete",
    "task.error",
    "input.required",
    "resource.limit",
    "user.spam"
  ],
  "language": "en",
  "license": "CC-BY-NC-4.0",
  "total_size_bytes": 167005,
  "sound_count": 21,
  "tags": [
    "gaming",
    "warcraft",
    "blizzard",
    "rts"
  ],
  "added": "2026-02-12",
  "updated": "2026-02-12"
}
