{
  "name": "sc_battlecruiser",
  "display_name": "StarCraft Battlecruiser",
  "version": "1.0.0",
  "description": "StarCraft Battlecruiser sound pack from StarCraft",
  "author": {
    "name": "garysheng",
    "github": "garysheng"
  },
  "source": {
    "type": "github",
    "repo": "PeonPing/og-packs",
    "ref": "v1.0.0",
    "path": "sc_battlecruiser"
  },
  "manifest_sha256": "70ea29abbb0b380def6cebda44af2d06e7191e6ee90565e4119cf0a4df472b50",
  "trust_tier": "official",
  "categories": [
    "session.start",
    "task.acknowledge",
    "task.complete",
    "input.required",
    "user.spam"
  ],
  "language": "en",
  "license": "CC-BY-NC-4.0",
  "total_size_bytes": 423109,
  "sound_count": 13,
  "tags": [
    "gaming",
    "starcraft",
    "blizzard",
    "rts"
  ],
  "added": "2026-02-12",
  "updated": "2026-02-12"
}
