{
  "name": "sc_scv",
  "display_name": "StarCraft SCV",
  "version": "1.0.0",
  "description": "StarCraft SCV sound pack from StarCraft",
  "author": {
    "name": "workdd",
    "github": "workdd"
  },
  "source": {
    "type": "github",
    "repo": "PeonPing/og-packs",
    "ref": "v1.0.0",
    "path": "sc_scv"
  },
  "manifest_sha256": "c8336067ff6a8d2283793aa5470437fca410216d15ecff7c5a9fcaa5259b2d39",
  "trust_tier": "official",
  "categories": [
    "session.start",
    "task.acknowledge",
    "task.complete",
    "input.required"
  ],
  "language": "en",
  "license": "CC-BY-NC-4.0",
  "total_size_bytes": 139424,
  "sound_count": 8,
  "tags": [
    "gaming",
    "starcraft",
    "blizzard",
    "rts"
  ],
  "added": "2026-02-12",
  "updated": "2026-02-12"
}
