{
  "name": "sc_medic",
  "display_name": "StarCraft Medic",
  "version": "1.0.0",
  "description": "StarCraft Medic sound pack from StarCraft",
  "author": {
    "name": "workdd",
    "github": "workdd"
  },
  "source": {
    "type": "github",
    "repo": "PeonPing/og-packs",
    "ref": "v1.0.0",
    "path": "sc_medic"
  },
  "manifest_sha256": "e343880992853185500750f5d7cf0030b190c2e9c38aa068535a6acd045d1548",
  "trust_tier": "official",
  "categories": [
    "session.start",
    "task.acknowledge",
    "task.complete",
    "input.required"
  ],
  "language": "en",
  "license": "CC-BY-NC-4.0",
  "total_size_bytes": 234145,
  "sound_count": 6,
  "tags": [
    "gaming",
    "starcraft",
    "blizzard",
    "rts"
  ],
  "added": "2026-02-12",
  "updated": "2026-02-12"
}
