{
  "name": "peon_ru",
  "display_name": "Orc Peon (Russian)",
  "version": "1.0.0",
  "description": "Orc Peon (Russian) sound pack from Warcraft III",
  "author": {
    "name": "maksimfedin",
    "github": "maksimfedin"
  },
  "source": {
    "type": "github",
    "repo": "PeonPing/og-packs",
    "ref": "v1.0.0",
    "path": "peon_ru"
  },
  "manifest_sha256": "05b0076d2f5601f6bc9b6a493440b5e7b98d200b979e77a955e7f22d5b7aa886",
  "trust_tier": "official",
  "categories": [
    "session.start",
    "task.acknowledge",
    "task.complete",
    "task.error",
    "input.required",
    "resource.limit",
    "user.spam"
  ],
  "language": "ru",
  "license": "CC-BY-NC-4.0",
  "total_size_bytes": 1117894,
  "sound_count": 25,
  "tags": [
    "gaming",
    "warcraft",
    "blizzard",
    "rts"
  ],
  "added": "2026-02-12",
  "updated": "2026-02-12"
}
