{
  "name": "dota2_axe",
  "display_name": "Axe (Dota 2)",
  "version": "1.0.0",
  "description": "Axe (Dota 2) sound pack from Dota 2",
  "author": {
    "name": "x-n2o",
    "github": "x-n2o"
  },
  "source": {
    "type": "github",
    "repo": "PeonPing/og-packs",
    "ref": "v1.0.0",
    "path": "dota2_axe"
  },
  "manifest_sha256": "5c1dd1cdc3c1517ca7c554b9bab4b5ca22f99ba3cc625ec7e4c527bd266b28a8",
  "trust_tier": "official",
  "categories": [
    "session.start",
    "task.acknowledge",
    "task.complete",
    "task.error",
    "input.required",
    "resource.limit",
    "user.spam"
  ],
  "language": "en",
  "license": "CC-BY-NC-4.0",
  "total_size_bytes": 538432,
  "sound_count": 20,
  "tags": [
    "gaming",
    "dota2",
    "valve",
    "moba"
  ],
  "added": "2026-02-12",
  "updated": "2026-02-12"
}
