{
  "name": "peon_pl",
  "display_name": "Orc Peon (Polish)",
  "version": "1.0.0",
  "description": "Orc Peon (Polish) sound pack from Warcraft III",
  "author": {
    "name": "ArturSkowronski",
    "github": "ArturSkowronski"
  },
  "source": {
    "type": "github",
    "repo": "PeonPing/og-packs",
    "ref": "v1.0.0",
    "path": "peon_pl"
  },
  "manifest_sha256": "bdacb2d514f6e85609eebdcb77ad25ecc76a385d1f8929d16843c03c98480b12",
  "trust_tier": "official",
  "categories": [
    "session.start",
    "task.acknowledge",
    "task.complete",
    "task.error",
    "input.required",
    "resource.limit",
    "user.spam"
  ],
  "language": "pl",
  "license": "CC-BY-NC-4.0",
  "total_size_bytes": 4026800,
  "sound_count": 22,
  "tags": [
    "gaming",
    "warcraft",
    "blizzard",
    "rts"
  ],
  "added": "2026-02-12",
  "updated": "2026-02-12"
}
