{
  "name": "duke_nukem",
  "display_name": "Duke Nukem",
  "version": "1.0.0",
  "description": "Duke Nukem sound pack from Duke Nukem",
  "author": {
    "name": "unknown",
    "github": "unknown"
  },
  "source": {
    "type": "github",
    "repo": "PeonPing/og-packs",
    "ref": "v1.0.0",
    "path": "duke_nukem"
  },
  "manifest_sha256": "d31b4bc666904b66280606a16476a1db80d01a5077107611bd3ab81be21b1214",
  "trust_tier": "official",
  "categories": [
    "session.start",
    "task.acknowledge",
    "task.complete",
    "task.error",
    "input.required",
    "resource.limit",
    "user.spam"
  ],
  "language": "en",
  "license": "CC-BY-NC-4.0",
  "total_size_bytes": 7737086,
  "sound_count": 24,
  "tags": [
    "gaming",
    "duke-nukem",
    "fps",
    "retro"
  ],
  "added": "2026-02-12",
  "updated": "2026-02-12"
}
