{
  "name": "sc_vessel",
  "display_name": "StarCraft Science Vessel",
  "version": "1.0.0",
  "description": "StarCraft Science Vessel sound pack from StarCraft",
  "author": {
    "name": "workdd",
    "github": "workdd"
  },
  "source": {
    "type": "github",
    "repo": "PeonPing/og-packs",
    "ref": "v1.0.0",
    "path": "sc_vessel"
  },
  "manifest_sha256": "f8c686baa9740362afc134b2fdd6935f5f26a7f567dcdea0378fa2526709f966",
  "trust_tier": "official",
  "categories": [
    "session.start",
    "task.acknowledge",
    "task.complete",
    "input.required"
  ],
  "language": "en",
  "license": "CC-BY-NC-4.0",
  "total_size_bytes": 173504,
  "sound_count": 6,
  "tags": [
    "gaming",
    "starcraft",
    "blizzard",
    "rts"
  ],
  "added": "2026-02-12",
  "updated": "2026-02-12"
}
