{
  "name": "brewmaster_ru",
  "display_name": "Pandaren Brewmaster (Russian)",
  "version": "1.0.0",
  "description": "Pandaren Brewmaster (Russian) sound pack from Warcraft III",
  "author": {
    "name": "rubywwwilde",
    "github": "rubywwwilde"
  },
  "source": {
    "type": "github",
    "repo": "PeonPing/og-packs",
    "ref": "v1.0.0",
    "path": "brewmaster_ru"
  },
  "manifest_sha256": "f4e23ae91110b0beb9e241661c8a4bb659cf867f7e8ff1cf5f71528f96583c11",
  "trust_tier": "official",
  "categories": [
    "session.start",
    "task.acknowledge",
    "task.complete",
    "task.error",
    "input.required",
    "resource.limit",
    "user.spam"
  ],
  "language": "ru",
  "license": "CC-BY-NC-4.0",
  "total_size_bytes": 2551528,
  "sound_count": 23,
  "tags": [
    "gaming",
    "warcraft",
    "blizzard",
    "rts"
  ],
  "added": "2026-02-12",
  "updated": "2026-02-12"
}
