{
  "name": "peasant",
  "display_name": "Human Peasant",
  "version": "1.0.0",
  "description": "Human Peasant sound pack from Warcraft III",
  "author": {
    "name": "thomasKn",
    "github": "thomasKn"
  },
  "source": {
    "type": "github",
    "repo": "PeonPing/og-packs",
    "ref": "v1.0.0",
    "path": "peasant"
  },
  "manifest_sha256": "7b32349f0c2734edc739c022d8fe3185b7be8f59e15f70743564c597c3a11848",
  "trust_tier": "official",
  "categories": [
    "session.start",
    "task.acknowledge",
    "task.complete",
    "task.error",
    "input.required",
    "resource.limit",
    "user.spam"
  ],
  "language": "en",
  "license": "CC-BY-NC-4.0",
  "total_size_bytes": 1310954,
  "sound_count": 25,
  "tags": [
    "gaming",
    "warcraft",
    "blizzard",
    "rts"
  ],
  "added": "2026-02-12",
  "updated": "2026-02-12"
}
