{
  "name": "sc_firebat",
  "display_name": "StarCraft Firebat",
  "version": "1.0.0",
  "description": "StarCraft Firebat sound pack from StarCraft",
  "author": {
    "name": "workdd",
    "github": "workdd"
  },
  "source": {
    "type": "github",
    "repo": "PeonPing/og-packs",
    "ref": "v1.0.0",
    "path": "sc_firebat"
  },
  "manifest_sha256": "ddd814834e50d73c3338753fefcd801b710bbb419205bbaf81649c62d0f64c5b",
  "trust_tier": "official",
  "categories": [
    "session.start",
    "task.acknowledge",
    "task.complete",
    "input.required"
  ],
  "language": "en",
  "license": "CC-BY-NC-4.0",
  "total_size_bytes": 146143,
  "sound_count": 7,
  "tags": [
    "gaming",
    "starcraft",
    "blizzard",
    "rts"
  ],
  "added": "2026-02-12",
  "updated": "2026-02-12"
}
