{
  "name": "molag_bal",
  "display_name": "Molag Bal",
  "version": "1.0.0",
  "description": "Molag Bal sound pack from The Elder Scrolls",
  "author": {
    "name": "lloydaf",
    "github": "lloydaf"
  },
  "source": {
    "type": "github",
    "repo": "PeonPing/og-packs",
    "ref": "v1.0.0",
    "path": "molag_bal"
  },
  "manifest_sha256": "401792f309e0831b5995ff178a41785a3952682a769bca21fed34c018c743fca",
  "trust_tier": "official",
  "categories": [
    "session.start",
    "task.acknowledge",
    "task.complete",
    "task.error",
    "input.required",
    "user.spam"
  ],
  "language": "en",
  "license": "CC-BY-NC-4.0",
  "total_size_bytes": 25545048,
  "sound_count": 29,
  "tags": [
    "gaming",
    "elder-scrolls",
    "bethesda",
    "rpg"
  ],
  "added": "2026-02-12",
  "updated": "2026-02-12"
}
