{
  "name": "sheogorath",
  "display_name": "Sheogorath",
  "version": "1.0.0",
  "description": "Sheogorath sound pack from The Elder Scrolls",
  "author": {
    "name": "lloydaf",
    "github": "lloydaf"
  },
  "source": {
    "type": "github",
    "repo": "PeonPing/og-packs",
    "ref": "v1.0.0",
    "path": "sheogorath"
  },
  "manifest_sha256": "2c25c16b8691d4ec5ada7120bf9be40d5705e9955b653da5f84d01b8283b8ce3",
  "trust_tier": "official",
  "categories": [
    "session.start",
    "task.acknowledge",
    "task.complete",
    "task.error",
    "input.required",
    "user.spam"
  ],
  "language": "en",
  "license": "CC-BY-NC-4.0",
  "total_size_bytes": 14615993,
  "sound_count": 41,
  "tags": [
    "gaming",
    "elder-scrolls",
    "bethesda",
    "rpg"
  ],
  "added": "2026-02-12",
  "updated": "2026-02-12"
}
