{
  "name": "acolyte_ru",
  "display_name": "Undead Acolyte (Russian)",
  "version": "1.0.0",
  "description": "Undead Acolyte (Russian) sound pack from Warcraft III",
  "author": {
    "name": "maksimfedin",
    "github": "maksimfedin"
  },
  "source": {
    "type": "github",
    "repo": "PeonPing/og-packs",
    "ref": "v1.0.0",
    "path": "acolyte_ru"
  },
  "manifest_sha256": "c988eff118c207b8bd8f6902c0686e6f9e65a4901c215c8ae51b894546357a23",
  "trust_tier": "official",
  "categories": [
    "session.start",
    "task.acknowledge",
    "task.complete",
    "task.error",
    "input.required",
    "resource.limit",
    "user.spam"
  ],
  "language": "ru",
  "license": "CC-BY-NC-4.0",
  "total_size_bytes": 2984156,
  "sound_count": 30,
  "tags": [
    "gaming",
    "warcraft",
    "blizzard",
    "rts"
  ],
  "added": "2026-02-12",
  "updated": "2026-02-12"
}
