{
  "name": "rick",
  "display_name": "Rick Sanchez",
  "version": "1.0.0",
  "description": "Rick Sanchez sound pack from Rick and Morty",
  "author": {
    "name": "ranjitp16",
    "github": "ranjitp16"
  },
  "source": {
    "type": "github",
    "repo": "PeonPing/og-packs",
    "ref": "v1.0.0",
    "path": "rick"
  },
  "manifest_sha256": "c0097725338aa6d9f308d1948dbb60600105f5c10f8329c091e5f974758e42e1",
  "trust_tier": "official",
  "categories": [
    "session.start",
    "task.acknowledge",
    "task.complete",
    "task.error",
    "input.required",
    "resource.limit",
    "user.spam"
  ],
  "language": "en",
  "license": "CC-BY-NC-4.0",
  "total_size_bytes": 420414,
  "sound_count": 14,
  "tags": [
    "tv",
    "animation",
    "comedy"
  ],
  "added": "2026-02-12",
  "updated": "2026-02-12"
}
