{
  "name": "peon",
  "display_name": "Orc Peon",
  "version": "1.0.0",
  "description": "Orc Peon sound pack from Warcraft III",
  "author": {
    "name": "tonyyont",
    "github": "tonyyont"
  },
  "source": {
    "type": "github",
    "repo": "PeonPing/og-packs",
    "ref": "v1.0.0",
    "path": "peon"
  },
  "manifest_sha256": "565178cd55b46a66d443a9e8c001fa51926413d5e562677b43a5de2381c7fe8e",
  "trust_tier": "official",
  "categories": [
    "session.start",
    "task.acknowledge",
    "task.complete",
    "task.error",
    "input.required",
    "resource.limit",
    "user.spam"
  ],
  "language": "en",
  "license": "CC-BY-NC-4.0",
  "total_size_bytes": 872012,
  "sound_count": 27,
  "tags": [
    "gaming",
    "warcraft",
    "blizzard",
    "rts"
  ],
  "added": "2026-02-12",
  "updated": "2026-02-12"
}
