{
  "name": "sc_terran",
  "display_name": "StarCraft Terran (All Units)",
  "version": "1.0.0",
  "description": "StarCraft Terran (All Units) sound pack from StarCraft",
  "author": {
    "name": "workdd",
    "github": "workdd"
  },
  "source": {
    "type": "github",
    "repo": "PeonPing/og-packs",
    "ref": "v1.0.0",
    "path": "sc_terran"
  },
  "manifest_sha256": "5afe83c6dddc3b317a79efdd14c43439c0543b005ab199697f78027d11c218b3",
  "trust_tier": "official",
  "categories": [
    "session.start",
    "task.acknowledge",
    "task.complete",
    "task.error",
    "input.required",
    "resource.limit",
    "user.spam"
  ],
  "language": "en",
  "license": "CC-BY-NC-4.0",
  "total_size_bytes": 885414,
  "sound_count": 17,
  "tags": [
    "gaming",
    "starcraft",
    "blizzard",
    "rts"
  ],
  "added": "2026-02-12",
  "updated": "2026-02-12"
}
