{
  "name": "peon_cz",
  "display_name": "Orčí peón (CZ)",
  "version": "1.0.0",
  "description": "Orčí peón (CZ) sound pack from Warcraft III",
  "author": {
    "name": "vojtabiberle",
    "github": "vojtabiberle"
  },
  "source": {
    "type": "github",
    "repo": "PeonPing/og-packs",
    "ref": "v1.0.0",
    "path": "peon_cz"
  },
  "manifest_sha256": "426491ade6b692805fde7425f80a5513b1c15ff54a65288765481328b859c186",
  "trust_tier": "official",
  "categories": [
    "session.start",
    "task.acknowledge",
    "task.complete",
    "task.error",
    "input.required",
    "resource.limit",
    "user.spam"
  ],
  "language": "cs",
  "license": "CC-BY-NC-4.0",
  "total_size_bytes": 1295067,
  "sound_count": 27,
  "tags": [
    "gaming",
    "warcraft",
    "blizzard",
    "rts"
  ],
  "added": "2026-02-12",
  "updated": "2026-02-12"
}
