{
  "name": "peasant_fr",
  "display_name": "Paysan Humain (FR)",
  "version": "1.0.0",
  "description": "Paysan Humain (FR) sound pack from Warcraft III",
  "author": {
    "name": "thomasKn",
    "github": "thomasKn"
  },
  "source": {
    "type": "github",
    "repo": "PeonPing/og-packs",
    "ref": "v1.0.0",
    "path": "peasant_fr"
  },
  "manifest_sha256": "2662c8df5d454b554e1541b4a441d58f1620e9665a8a15388a07720e89ed31f6",
  "trust_tier": "official",
  "categories": [
    "session.start",
    "task.acknowledge",
    "task.complete",
    "task.error",
    "input.required",
    "resource.limit",
    "user.spam"
  ],
  "language": "fr",
  "license": "CC-BY-NC-4.0",
  "total_size_bytes": 1580126,
  "sound_count": 25,
  "tags": [
    "gaming",
    "warcraft",
    "blizzard",
    "rts"
  ],
  "added": "2026-02-12",
  "updated": "2026-02-12"
}
