{
  "name": "ra2_kirov",
  "display_name": "RA2 Kirov Airship",
  "version": "1.0.0",
  "description": "RA2 Kirov Airship sound pack from Command & Conquer: Red Alert 2",
  "author": {
    "name": "i-zhirov",
    "github": "i-zhirov"
  },
  "source": {
    "type": "github",
    "repo": "PeonPing/og-packs",
    "ref": "v1.0.0",
    "path": "ra2_kirov"
  },
  "manifest_sha256": "2099a50bd9fa0db593981f80ac4141bffa4cd2626bd3d501fe32c82d7e472094",
  "trust_tier": "official",
  "categories": [
    "session.start",
    "task.acknowledge",
    "task.complete",
    "task.error",
    "input.required",
    "resource.limit",
    "user.spam"
  ],
  "language": "en",
  "license": "CC-BY-NC-4.0",
  "total_size_bytes": 367012,
  "sound_count": 19,
  "tags": [
    "gaming",
    "command-and-conquer",
    "ea",
    "rts"
  ],
  "added": "2026-02-12",
  "updated": "2026-02-12"
}
