{
  "name": "peasant_cz",
  "display_name": "Lidský rolník (CZ)",
  "version": "1.0.0",
  "description": "Lidský rolník (CZ) sound pack from Warcraft III",
  "author": {
    "name": "vojtabiberle",
    "github": "vojtabiberle"
  },
  "source": {
    "type": "github",
    "repo": "PeonPing/og-packs",
    "ref": "v1.0.0",
    "path": "peasant_cz"
  },
  "manifest_sha256": "337d61b71f94d0d1fd35cd57ed3af6c9cb0597031f003259fd1b52df24b24245",
  "trust_tier": "official",
  "categories": [
    "session.start",
    "task.acknowledge",
    "task.complete",
    "task.error",
    "input.required",
    "resource.limit",
    "user.spam"
  ],
  "language": "cs",
  "license": "CC-BY-NC-4.0",
  "total_size_bytes": 1804107,
  "sound_count": 25,
  "tags": [
    "gaming",
    "warcraft",
    "blizzard",
    "rts"
  ],
  "added": "2026-02-12",
  "updated": "2026-02-12"
}
