{
  "name": "ra2_soviet_engineer",
  "display_name": "RA2 Soviet Engineer",
  "version": "1.0.0",
  "description": "RA2 Soviet Engineer sound pack from Command & Conquer: Red Alert 2",
  "author": {
    "name": "msukkari",
    "github": "msukkari"
  },
  "source": {
    "type": "github",
    "repo": "PeonPing/og-packs",
    "ref": "v1.0.0",
    "path": "ra2_soviet_engineer"
  },
  "manifest_sha256": "bc588337d5dd0edfb86f0b9a727b45f2be826558dc99a4dcb3f2b2dd0718f28c",
  "trust_tier": "official",
  "categories": [
    "session.start",
    "task.acknowledge",
    "task.complete",
    "task.error",
    "input.required",
    "resource.limit",
    "user.spam"
  ],
  "language": "en",
  "license": "CC-BY-NC-4.0",
  "total_size_bytes": 58190,
  "sound_count": 12,
  "tags": [
    "gaming",
    "command-and-conquer",
    "ea",
    "rts"
  ],
  "added": "2026-02-12",
  "updated": "2026-02-12"
}
