{
  "name": "peasant_ru",
  "display_name": "Human Peasant (Russian)",
  "version": "1.0.0",
  "description": "Human Peasant (Russian) sound pack from Warcraft III",
  "author": {
    "name": "maksimfedin",
    "github": "maksimfedin"
  },
  "source": {
    "type": "github",
    "repo": "PeonPing/og-packs",
    "ref": "v1.0.0",
    "path": "peasant_ru"
  },
  "manifest_sha256": "565dda4d4d90339f30e44a29b3456c3ca8e6228633cb64dba33b764ea6181db2",
  "trust_tier": "official",
  "categories": [
    "session.start",
    "task.acknowledge",
    "task.complete",
    "task.error",
    "input.required",
    "resource.limit",
    "user.spam"
  ],
  "language": "ru",
  "license": "CC-BY-NC-4.0",
  "total_size_bytes": 979198,
  "sound_count": 18,
  "tags": [
    "gaming",
    "warcraft",
    "blizzard",
    "rts"
  ],
  "added": "2026-02-12",
  "updated": "2026-02-12"
}
